{
  "apiVersion": "doppels.so/v1alpha1",
  "kind": "ShareMessage",
  "messageId": "e154ce43-81ce-45ea-ab97-610c0169a7d6",
  "shareId": "aa222d6a-0fc8-4dc1-b9b5-0e4673a2d7de",
  "occurredAt": "2026-08-01T10:00:02.100Z",
  "event": "run_recorded",
  "payload": {
    "apiVersion": "doppels.so/v1alpha1",
    "kind": "Run",
    "id": "7b8b7f76-7cac-4b79-b879-2d32dd41c9e7",
    "requestId": "3e5853b0-51ab-4fef-b402-486e02146591",
    "createdAt": "2026-08-01T10:00:02Z",
    "capability": {
      "name": "release-preview",
      "version": "1.0.0",
      "manifestSha256": "3e8485b6d578eaba3588833e2353adf642432266600e831c7d32e9c8727b1810",
      "schema": {
        "id": "https://doppels.so/schemas/v1alpha1/capability.schema.json",
        "sha256": "97a290a319a56263c5717316f6bcf630d7021961010c18a3dc8c73047e5de367"
      }
    },
    "recipe": {
      "name": "release-preview",
      "version": "1.0.0",
      "manifestSha256": "06389291763c058e928718305659b4377de7b56db7fb9de24735cf0a0398196b",
      "schema": {
        "id": "https://doppels.so/schemas/v1alpha1/recipe.schema.json",
        "sha256": "0cfb744ce46839081f028c372fd840ee80465ba3dc978009dd37c73c2072381c"
      }
    },
    "inputs": {
      "release_version": "1.2.0",
      "environment": "staging"
    },
    "executor": {
      "kind": "identity",
      "id": "carlos@example.test"
    },
    "nodeId": "carlos-laptop"
  }
}
