{
  "apiVersion": "doppels.so/v1alpha1",
  "kind": "ShareMessage",
  "messageId": "d3b49690-99a4-4237-9a40-d87b817f9cee",
  "shareId": "aa222d6a-0fc8-4dc1-b9b5-0e4673a2d7de",
  "occurredAt": "2026-08-01T10:00:02Z",
  "event": "run_submitted",
  "payload": {
    "apiVersion": "doppels.so/v1alpha1",
    "kind": "Run",
    "id": "7b8b7f76-7cac-4b79-b879-2d32dd41c9e7",
    "requestId": "3e5853b0-51ab-4fef-b402-486e02146591",
    "createdAt": "2026-08-01T10:00:02Z",
    "capability": {
      "name": "release-preview",
      "version": "1.0.0",
      "manifestSha256": "3e8485b6d578eaba3588833e2353adf642432266600e831c7d32e9c8727b1810",
      "schema": {
        "id": "https://doppels.so/schemas/v1alpha1/capability.schema.json",
        "sha256": "531ff668bef1930d271f98ddd4d53484dde28b7e3b770df009bb580d1e93967a"
      }
    },
    "recipe": {
      "name": "release-preview",
      "version": "1.0.0",
      "manifestSha256": "06389291763c058e928718305659b4377de7b56db7fb9de24735cf0a0398196b",
      "schema": {
        "id": "https://doppels.so/schemas/v1alpha1/recipe.schema.json",
        "sha256": "14cb3191c7ba24b7895ad4f52eb57531a3fe76b4fe8c855eaf1246d28148fa66"
      }
    },
    "inputs": {
      "release_version": "1.2.0",
      "environment": "staging"
    },
    "executor": {
      "kind": "identity",
      "id": "carlos@example.test"
    },
    "nodeId": "carlos-laptop"
  }
}
